citation_id,folder,subfolder,title_en,title_zh,authors,year,journal,study_design_zh,therapy_modality_en,therapy_modality_zh,indication_en,indication_zh,clinical_scene_zh,key_techniques_en,key_techniques_zh,evidence_level,recommendation_level_zh,citation_count_epmc,citation_count_source,citation_count_snapshot_date,journal_publisher,journal_best_quartile,journal_sjr_2025,journal_h_index_2025,journal_rank_2025,journal_impact_score_2024_2025,journal_scope,journal_metrics_source,journal_metrics_url,pmid,pmcid,doi,is_open_access,in_pmc,has_pdf,auth_manuscript,best_free_fulltext_url,all_fulltext_urls,primary_url,local_pmc_pdf,abstract_en,abstract_summary_zh,why_included_zh,practical_takeaway_zh,can_be_used_as_core_evidence
core_family_schizophrenia_2022_rodolico,01_core_evidence,family_and_systemic,Family interventions for relapse prevention in schizophrenia: a systematic review and network meta-analysis.,家庭干预用于精神分裂症复发预防：系统综述与网络元分析,"Rodolico A, Bighelli I, Avanzato C, Concerto C, Cutrufelli P, Mineo L, Schneider-Thoma J, Siafis S, Signorelli MS, Wu H, Wang D, Furukawa TA, Pitschel-Walz G, Aguglia E, Leucht S.",2022,The lancet. Psychiatry,系统综述与网络元分析,Family intervention / systemic family treatment,家庭干预 / 系统家庭治疗,Schizophrenia relapse prevention,精神分裂症复发预防,适合高情绪表达、高照护负担、复发和家庭压力绑得很紧的场景。,Psychoeducation; communication training; problem solving; relapse warning management,家庭心理教育、沟通训练、问题解决、复发预警管理,High,强烈推荐,66,Europe PMC citedByCount,2026-06-26,Elsevier Ltd,Q1,7.458,160,145,7.51,Biological Psychiatry (Q1); Psychiatry and Mental Health (Q1),Resurchify / SCImago snapshot,https://www.resurchify.com/impact/details/21100356804,35093198,,10.1016/s2215-0366(21)00437-5,N,N,N,N,https://doi.org/10.1016/S2215-0366(21)00437-5,https://doi.org/10.1016/S2215-0366(21)00437-5,https://doi.org/10.1016/s2215-0366(21)00437-5,,"Background Family interventions are efficacious for relapse prevention in schizophrenia. Multiple different models have been developed. We aimed to compare the efficacy, acceptability, and tolerability of family interventions for relapse prevention in schizophrenia. Methods In this systematic review and network meta-analysis, we searched for randomised controlled trials that investigated family intervention models aimed at preventing relapse in patients with schizophrenia. We searched EMBASE, MEDLINE, PsycINFO, BIOSIS, CENTRAL, ClinicalTrials.gov, and WHO International Clinical Trials Registry Platform up to Jan 20, 2020 and PubMed up to July 15, 2021. We included blinded and open-label randomised controlled trials in which at least 80% of patients had schizophrenia spectrum disorders. We excluded studies in which all patients were acutely ill, had a concurrent medical or psychiatric disorder, or were prodromal or ""at risk of psychosis"". Study selection and data extraction were done by two independent reviewers. Data were extracted about overall, positive, negative, and depressive symptoms of schizophrenia, quality of life, adherence, overall functioning, family burden, expressed emotion, and discontinuations due to inefficacy. The primary outcome was relapse, measured with operationalised criteria, psychiatric hospital admissions, or clinical judgement. We did a frequentist, random-effects, network meta-analysis to calculate odds ratios ([ORs]; dichotomous outcomes) or standardised mean differences (continuous outcomes) with 95% CIs. The study protocol was registered with PROSPERO, CRD42020169951. Findings We identified 28 395 studies through the database search and 334 from references of previous studies. We compared 11 family intervention models tested on a total of 90 randomised controlled trials with 10 340 participants (3579 females and 5632 males with sex indicated; median age 31 years [range 14-65]) in the network meta-analysis. Ethnicity data were not available. All interventions, with the exception of crisis-oriented interventions and family psychoeducation with two sessions or fewer, reduced the relapse rate significantly when compared with treatment as usual at the primary timepoint of 12 months. ORs compared with treatment as usual ranged from 0·18 (95% CI 0·12-0·27) for family psychoeducation alone to 0·63 (0·42-0·94) for community-based interventions involving family members. The results were robust in various sensitivity and subgroup analyses. The confidence in the estimates ranged from moderate to very low for different comparisons. Interpretation Almost all family intervention models were efficacious in preventing relapse in schizophrenia. Family psychoeducation alone, without behavioural or skills training, was superior to the more complex models. Our results suggest that in contexts where there are financial constraints, family psychoeducation alone should be implemented. Funding German Ministry for Education and Research.",家庭干预对精神分裂症复发预防有硬证据支持。,系统治疗在这个适应症上很强，必须单列。,这类个案里，家庭气候本身就是治疗变量。,yes
core_family_anorexia_2024_murray,01_core_evidence,family_and_systemic,Efficacy of Eating Disorder Focused Family Therapy for Adolescents With Anorexia Nervosa: A Systematic Review and Meta-Analysis.,聚焦进食障碍的家庭治疗用于青少年神经性厌食：系统综述与元分析,"Austin A, Anderson AG, Lee J, Vander Steen H, Savard C, Bergmann C, Singh M, Devoe D, Gorrell S, Patten S, Le Grange D, Dimitropoulos G.",2025,The International journal of eating disorders,系统综述与元分析,Eating-disorder-focused family therapy,聚焦进食障碍的家庭治疗,Adolescent anorexia nervosa,青少年神经性厌食,适合青春期厌食、体重下降、家庭高度卷入又容易冲突升级的场景。,Family-based treatment; caregiver refeeding support; alliance restructuring,家庭基础治疗、照护者再喂养支持、联盟重建,High,强烈推荐,20,Europe PMC citedByCount,2026-06-26,John Wiley and Sons Inc,Q1,1.703,163,1907,4.35,Psychiatry and Mental Health (Q1),Resurchify / SCImago snapshot,https://www.resurchify.com/impact/details/12675,39041682,PMC11754536,10.1002/eat.24252,Y,Y,Y,Y,https://pmc.ncbi.nlm.nih.gov/articles/PMC11754536/,https://escholarship.org/uc/item/90j9z91q | https://doi.org/10.1002/eat.24252 | https://europepmc.org/articles/PMC11754536 | https://europepmc.org/articles/PMC11754536?pdf=render | https://pmc.ncbi.nlm.nih.gov/articles/PMC11754536/,https://doi.org/10.1002/eat.24252,reference_archive/_downloads_pmc_pdfs/2025_core_family_anorexia_2024_murray.pdf,"Objective To systematically review and evaluate the efficacy of eating disorder focused family therapy (FT-ED) in comparison to all other forms of psychotherapy for children and adolescents with anorexia nervosa. A secondary aim is to assess the relative efficacy of different variations of FT-ED (e.g., shorter vs. longer dose, parent-focused). Methods A search with relevant terms was systematically conducted on four databases. Twenty-three publications across 18 randomized controlled trials met inclusion criteria. Outcomes of interest included variables related to weight, eating psychopathology, and remission status. Study quality was assessed, and data were extracted by two independent researchers. Results Adolescents receiving FT-ED gained significantly more weight by the end of treatment in comparison to those receiving individual psychotherapy. FT-ED that was delivered just to parents or to parents and child separately offered preferable weight outcomes and rates of recovery at the end of treatment in comparison to conjoint FT-ED. No other outcomes tested in the meta-analysis were statistically significant at the end of treatment or follow-up. Discussion Currently available data suggest the use of FT-ED in its conjoint or separated/parent focused format is the best outpatient treatment option for adolescents with anorexia nervosa when immediate weight gain is paramount. The variability of outcome measurement, including the tools used and timepoints chosen, limit comparison among no more than a handful of studies. The field would benefit from the standardization of measurement and reporting guidelines for future clinical trials. Trial registration PROSPERO number: CRD42023396263.",青少年厌食症里，家庭治疗通常是主轴。,补强系统治疗在厌食症中的经典适应症。,患者还深嵌家庭系统时，单人治疗常常不够。,yes
core_perinatal_cbt_2022_li,01_core_evidence,perinatal,"Effectiveness of cognitive behavioral therapy for perinatal maternal depression, anxiety and stress: A systematic review and meta-analysis of randomized controlled trials.",CBT 对围产期母亲抑郁、焦虑和压力的效果：随机对照试验系统综述与元分析,"Li X, Laplante DP, Paquin V, Lafortune S, Elgbeili G, King S.",2022,Clinical psychology review,系统综述与元分析,CBT for perinatal mental health,围产期心理健康的 CBT,"Perinatal depression, anxiety, and stress",围产期抑郁、焦虑和压力,适合孕期或产后因角色变化、睡眠剥夺、照护压力而恶化的情绪问题。,Behavioral activation; cognitive restructuring; stress management; problem solving,行为激活、认知重构、压力管理、问题解决,High,强烈推荐,69,Europe PMC citedByCount,2026-06-26,Elsevier Inc.,Q1,6.617,269,180,13.66,Clinical Psychology (Q1); Psychiatry and Mental Health (Q1),Resurchify / SCImago snapshot,https://www.resurchify.com/impact/details/12854,35123346,,10.1016/j.cpr.2022.102129,N,N,N,N,https://doi.org/10.1016/j.cpr.2022.102129,https://doi.org/10.1016/j.cpr.2022.102129,https://doi.org/10.1016/j.cpr.2022.102129,,"Cognitive behavioral therapy (CBT) has been widely studied in prenatal or postnatal depression, with much less research on anxiety and stress. This meta-analysis aims to comprehensively evaluate CBT efficacy for perinatal depression, anxiety and stress in the short term (from baseline to immediately post-intervention) and in the long term (from baseline to the end of follow-up). Five databases were searched. We included 79 randomized controlled trials (RCTs) and quasi-RCTs assessing the efficacy of CBT during pregnancy and the first year postpartum. Primary outcome was the mean score change in depression, anxiety and stress. CBT-only and CBT plus other interventions were effective for perinatal maternal depression in the short term (SMD -0.69, 95% CI: -0.83, -0.55) and long term (SMD -0.59, 95% CI -0.75, -0.42). CBT-only had both short- and long-term efficacy for perinatal anxiety (short term: SMD -0.63, 95% CI -0.85, -0.42; long term: SMD -0.71, 95% CI -1.02, -0.39) and short-term efficacy for perinatal stress (SMD -0.96, 95% CI -1.40, -0.52). Overall, CBT was effective for perinatal maternal depression, anxiety and stress. CBT-only exhibited short-term efficacy for perinatal depression, anxiety and stress, and long-term efficacy for perinatal depression and anxiety. Subgroup analyses suggested that CBT-only was effective across a wide variety of modalities.",围产期 CBT 证据稳定，抑郁、焦虑和压力都能覆盖到。,把抑郁板块扩到真实高频的围产期场景。,围产期干预要同时看认知、节律和支持系统。,yes
guideline_nice_2022_depression,02_guidelines,depression,Depression in adults: treatment and management (NG222),成人抑郁：治疗与管理（NICE NG222）,National Institute for Health and Care Excellence,2022,NICE Guideline,临床实践指南,Guideline-level multimodal recommendations,指南级多模式治疗建议,Adult depression,成人抑郁,适合把研究证据转成临床路径和优先级时使用。,CBT; behavioral activation; IPT; short-term psychodynamic approaches; stepped care,CBT、行为激活、IPT、短程动力学治疗、分层照护,High,核心指南,,,,National Institute for Health and Care Excellence,,,,,,Clinical guideline,Institutional guideline,https://www.nice.org.uk/guidance/ng222,,,,,,,,,,https://www.nice.org.uk/guidance/ng222,,,NICE 的价值在排序。它把证据转成了能执行的治疗路径。,做方案排序时要回到指南。,知道有证据和知道先做什么，是两回事。,yes
guideline_apa_2019_depression,02_guidelines,depression,Clinical Practice Guideline for the Treatment of Depression Across Three Age Cohorts,跨三个年龄队列的抑郁治疗临床实践指南,American Psychological Association,2019,APA Guideline,临床实践指南,Guideline-level multimodal recommendations,指南级多模式治疗建议,Depression across age cohorts,不同年龄层抑郁治疗,适合比较不同年龄层抑郁治疗推荐时使用。,Evidence-based psychotherapy selection across age groups,分年龄层的循证心理治疗选择,High,核心指南,,,,American Psychological Association,,,,,,Clinical guideline,Institutional guideline,https://www.apa.org/depression-guideline,,,,,,,,,,https://www.apa.org/depression-guideline,,,APA 指南更强调年龄分层，适合和 NICE 对照看。,补足美国体系下的年龄维度。,儿童、成人、老年抑郁不能用同一套优先级硬套。,yes
support_ataglance_2024,03_supporting_overviews,general_psychotherapy,Psychotherapies at a Glance: Consensus Guideline-Recommended Psychotherapies for Adults With Psychiatric Disorders.,心理治疗速览：成人精神障碍的指南共识推荐心理治疗,"Ravitz P, Flores LE, Novick D, Watson P, Swartz HA.",2024,American journal of psychotherapy,指南概览 / 导航文献,General psychotherapy overview,心理治疗总览,Adult psychiatric disorders,成人精神障碍总览,适合快速建立治疗地图，不适合直接当终局证据。,Overview-level recommendations,概览级建议，侧重导航,Moderate,补充推荐,5,Europe PMC citedByCount,2026-06-26,American Psychiatric Association,Q2,0.834,58,6371,1.65,Clinical Psychology (Q2); Medicine (miscellaneous) (Q2),Resurchify / SCImago snapshot,https://www.resurchify.com/impact/details/17666,38487817,,10.1176/appi.psychotherapy.20230004,N,N,N,N,https://doi.org/10.1176/appi.psychotherapy.20230004,https://doi.org/10.1176/appi.psychotherapy.20230004,https://doi.org/10.1176/appi.psychotherapy.20230004,,"Clinical decision making by psychiatrists and informed consent by patients require knowledge of evidence-based psychotherapies (EBPs) and their indications. However, many mental health professionals are not versed in the empirical literature on EBPs or the consensus guideline recommendations derived from this literature. The authors compared rigorous national consensus guidelines for EBP treatment of DSM -defined adult psychiatric disorders-derived from well-conducted randomized controlled trials and meta-analyses and from expert opinions from the United States, United Kingdom, and Canada-to create the Psychotherapies-at-a-Glance tool. Recommended EBPs are cognitive-behavioral therapy, family therapy, contingency management, dialectical behavior therapy, eye movement desensitization reprocessing, interpersonal psychotherapy, mentalization-based treatment, motivational interviewing, peer support, problem-solving therapy, psychoeducation, short-term psychodynamic psychotherapy, and 12-step facilitation. The Psychotherapies-at-a-Glance tool summarizes the indications, rationales, and therapeutic tasks that characterize these differing psychotherapies and psychosocial treatments. The tool is intended for use in clinical teaching, treatment planning, and patient communications.",导航文献。用来定方向很好，用来下结论不够。,检索入口好用。,先拿它找路，再回到元分析和指南。,no
theory_shedler_2010,04_theory_and_perspective,psychodynamic,The efficacy of psychodynamic psychotherapy.,心理动力学心理治疗的疗效,Shedler J.,2010,The American psychologist,理论综述 / 观点性综述,Psychodynamic psychotherapy,心理动力学治疗,Cross-diagnostic theory discussion,跨诊断理论讨论,适合理解动力学治疗在公共讨论里为什么总被误读。,Psychodynamic concepts overview,动力学概念总览,Supplementary,补充理论,352,Europe PMC citedByCount,2026-06-26,American Psychological Association,Q1,3.2,283,637,5.35,Medicine (miscellaneous) (Q1); Psychology (miscellaneous) (Q1),Resurchify / SCImago snapshot,https://www.resurchify.com/impact/details/29492,20141265,,10.1037/a0018378,N,N,N,N,https://doi.org/10.1037/a0018378,https://doi.org/10.1037/a0018378,https://doi.org/10.1037/a0018378,,"Empirical evidence supports the efficacy of psychodynamic therapy. Effect sizes for psychodynamic therapy are as large as those reported for other therapies that have been actively promoted as ""empirically supported"" and ""evidence based."" In addition, patients who receive psychodynamic therapy maintain therapeutic gains and appear to continue to improve after treatment ends. Finally, nonpsychodynamic therapies may be effective in part because the more skilled practitioners utilize techniques that have long been central to psychodynamic theory and practice. The perception that psychodynamic approaches lack empirical support does not accord with available scientific evidence and may reflect selective dissemination of research findings.",理论入口文。能帮助你看懂动力学的自我辩护逻辑。,留作理论补充，不放进核心证据排序。,拿它讲流派可以，拿它单扛疗效不行。,no
official_dbt_faq,05_official_explainers,dbt,Dialectical Behavior Therapy (DBT) FAQ,辩证行为治疗（DBT）常见问题,Behavioral Tech,n.d.,Official organization resource,机构说明文,DBT,辩证行为治疗,Emotion dysregulation and self-harm related presentations,情绪失调、自伤与高风险冲动相关表现,适合想快速弄清 DBT 结构和四大技能模块的时候。,Mindfulness; distress tolerance; emotion regulation; interpersonal effectiveness,正念、痛苦耐受、情绪调节、人际效能,Supplementary,机构说明,,,,Behavioral Tech,,,,,,Official explainer,Institutional explainer,https://behavioraltech.org/resources/faqs/dialectical-behavior-therapy-dbt/,,,,,,,,,,https://behavioraltech.org/resources/faqs/dialectical-behavior-therapy-dbt/,,,说明文。讲结构很清楚，但不属于疗效证据。,用于概念澄清。,把它当说明书，不要当元分析。,no
