citation_id,folder,subfolder,title_en,title_zh,authors,year,journal,study_design_zh,therapy_modality_en,therapy_modality_zh,indication_en,indication_zh,clinical_scene_zh,key_techniques_en,key_techniques_zh,evidence_level,recommendation_level_zh,citation_count_epmc,citation_count_source,citation_count_snapshot_date,journal_publisher,journal_best_quartile,journal_sjr_2025,journal_h_index_2025,journal_rank_2025,journal_impact_score_2024_2025,journal_scope,journal_metrics_source,journal_metrics_url,pmid,pmcid,doi,is_open_access,in_pmc,has_pdf,auth_manuscript,best_free_fulltext_url,all_fulltext_urls,primary_url,local_pmc_pdf,abstract_en,abstract_summary_zh,why_included_zh,practical_takeaway_zh,can_be_used_as_core_evidence
core_ipt_2016_cuijpers,01_core_evidence,ipt,Interpersonal Psychotherapy for Mental Health Problems: A Comprehensive Meta-Analysis.,人际心理治疗用于精神健康问题：综合元分析,"Cuijpers P, Donker T, Weissman MM, Ravitz P, Cristea IA.",2016,The American journal of psychiatry,综合元分析,IPT,人际心理治疗,Depression and selected mental health problems,抑郁及部分与关系事件相关的精神健康问题,适合情绪问题和失恋、丧亲、迁居、婚育、照护压力直接连在一起的个案。,Grief work; role transition work; interpersonal disputes; social support rebuilding,哀伤工作、角色转变工作、人际争端分析、社会支持重建,High,强烈推荐,128,Europe PMC citedByCount,2026-06-26,American Psychiatric Association,Q1,5.27,405,271,6.67,Psychiatry and Mental Health (Q1),Resurchify / SCImago snapshot,https://www.resurchify.com/impact/details/17664,27032627,,10.1176/appi.ajp.2015.15091141,N,N,N,N,https://doi.org/10.1176/appi.ajp.2015.15091141,https://doi.org/10.1176/appi.ajp.2015.15091141,https://doi.org/10.1176/appi.ajp.2015.15091141,,"Objective Interpersonal psychotherapy (IPT) has been developed for the treatment of depression but has been examined for several other mental disorders. A comprehensive meta-analysis of all randomized trials examining the effects of IPT for all mental health problems was conducted. Method Searches in PubMed, PsycInfo, Embase, and Cochrane were conducted to identify all trials examining IPT for any mental health problem. Results Ninety studies with 11,434 participants were included. IPT for acute-phase depression had moderate-to-large effects compared with control groups (g=0.60; 95% CI=0.45-0.75). No significant difference was found with other therapies (differential g=0.06) and pharmacotherapy (g=-0.13). Combined treatment was more effective than IPT alone (g=0.24). IPT in subthreshold depression significantly prevented the onset of major depression, and maintenance IPT significantly reduced relapse. IPT had significant effects on eating disorders, but the effects are probably slightly smaller than those of cognitive-behavioral therapy (CBT) in the acute phase of treatment. In anxiety disorders, IPT had large effects compared with control groups, and there is no evidence that IPT was less effective than CBT. There was risk of bias as defined by the Cochrane Collaboration in the majority of studies. There was little indication that the presence of bias influenced outcome. Conclusions IPT is effective in the acute treatment of depression and may be effective in the prevention of new depressive disorders and in preventing relapse. IPT may also be effective in the treatment of eating disorders and anxiety disorders and has shown promising effects in some other mental health disorders.",IPT 的主战场是抑郁，围产期和关系事件相关场景尤其突出。,它能把‘关系事件型抑郁’单独拎出来。,问题如果跟关系事件同步恶化，IPT 往往很贴题。,yes
core_pdt_2023_wienicke,01_core_evidence,psychodynamic,Efficacy and moderators of short-term psychodynamic psychotherapy for depression: A systematic review and meta-analysis of individual participant data.,短程心理动力学治疗抑郁的疗效与调节因素：个体参与者数据系统综述与元分析,"Wienicke FJ, Beutel ME, Zwerenz R, Brähler E, Fonagy P, Luyten P, Constantinou M, Barber JP, McCarthy KS, Solomonov N, Cooper PJ, De Pascalis L, Johansson R, Andersson G, Lemma A, Town JM, Abbass AA, Ajilchi B, Connolly Gibbons MB, López-Rodríguez J, Villamil-Salcedo V, Maina G, Rosso G, Twisk JWR, Burk WJ, Spijker J, Cuijpers P, Driessen E.",2023,Clinical psychology review,个体参与者数据系统综述与元分析,Psychodynamic therapy / STPP,短程心理动力学治疗,Depression,抑郁障碍，尤其伴随关系重演和防御结构者,适合反复陷进同一种关系脚本、情感表达受阻、防御明显的人。,Clarification; confrontation; interpretation; defense analysis; affect focus; transference work,澄清、对抗、解释、防御分析、情感聚焦、移情工作,High,中度到强烈推荐,7,Europe PMC citedByCount,2026-06-26,Elsevier Inc.,Q1,6.617,269,180,13.66,Clinical Psychology (Q1); Psychiatry and Mental Health (Q1),Resurchify / SCImago snapshot,https://www.resurchify.com/impact/details/12854,36958077,,10.1016/j.cpr.2023.102269,N,N,N,N,https://doi.org/10.1016/j.cpr.2023.102269,https://doi.org/10.1016/j.cpr.2023.102269 | https://doi.org/10.1016/j.cpr.2023.102269,https://doi.org/10.1016/j.cpr.2023.102269,,"Background Short-term psychodynamic psychotherapy (STPP) is frequently used to treat depression, but it is unclear which patients might benefit specifically. Individual participant data (IPD) meta-analyses can provide more precise effect estimates than conventional meta-analyses and identify patient-level moderators. This IPD meta-analysis examined the efficacy and moderators of STPP for depression compared to control conditions. Methods PubMed, PsycInfo, Embase, and Cochrane Library were searched September 1st, 2022, to identify randomized trials comparing STPP to control conditions for adults with depression. IPD were requested and analyzed using mixed-effects models. Results IPD were obtained from 11 of the 13 (84.6%) studies identified (n = 771/837, 92.1%; mean age = 40.8, SD = 13.3; 79.3% female). STPP resulted in significantly lower depressive symptom levels than control conditions at post-treatment (d = -0.62, 95%CI [-0.76, -0.47], p Conclusions These results support the evidence base of STPP for depression and indicate episode duration as an effect modifier. This moderator finding, however, is observational and requires prospective validation in future large-scale trials.",动力学治疗在抑郁里有稳定疗效。这篇用的是个体数据级别的综述。,动力学板块的核心证据之一。,症状总在重复同一种命运时，动力学视角很有用。,yes
core_ptsd_exposure_2022_wootton,01_core_evidence,trauma_and_ocd,Exposure therapy for PTSD: A meta-analysis.,PTSD 的暴露治疗：元分析,"McLean CP, Levy HC, Miller ML, Tolin DF.",2022,Clinical psychology review,元分析,Exposure therapy for PTSD,PTSD 的暴露治疗,PTSD,创伤后应激障碍,适合创伤后回避强、触发后失控快、警觉性高的人群。,Prolonged exposure; trauma processing; imaginal exposure; in vivo exposure,延长暴露、创伤加工、想象暴露、现实暴露,High,强烈推荐,116,Europe PMC citedByCount,2026-06-26,Elsevier Inc.,Q1,6.617,269,180,13.66,Clinical Psychology (Q1); Psychiatry and Mental Health (Q1),Resurchify / SCImago snapshot,https://www.resurchify.com/impact/details/12854,34954460,,10.1016/j.cpr.2021.102115,N,N,N,N,https://doi.org/10.1016/j.cpr.2021.102115,https://doi.org/10.1016/j.cpr.2021.102115,https://doi.org/10.1016/j.cpr.2021.102115,,"Posttraumatic stress disorder (PTSD) is associated with high morbidity and functional impairment in the absence of effective treatment. Exposure therapy for PTSD is a trauma-focused treatment that typically includes in vivo and/or imaginal exposure. The goal of this meta-analysis was to examine the overall efficacy of exposure therapy for PTSD compared to various control conditions. We also assessed the efficacy of individual exposure-based treatments and the potentially moderating impact of various demographic, clinical, and treatment-related factors. PsycINFO and Medline were searched for randomized controlled trials of exposure-based therapies for adult PTSD. A total of 934 abstracts were screened for initial eligibility; of these, 65 articles met inclusion criteria and were included in the meta-analysis (total N = 4929 patients). Exposure therapy showed large effects relative to waitlist and treatment-as-usual, a small effect relative to non-trauma-focused comparators and a negligible effect relative to other trauma-focused treatments or medication. At follow-up most effects sizes were stable, except for a medium effect favoring exposure over medication. The individual exposure-based therapies examined were similarly effective. Moderator analyses revealed larger effect sizes in studies with fewer sessions, younger samples, fewer participants diagnosed with substance use disorder, and fewer participants on psychiatric medication. Effect sizes were also larger in studies of refugees and civilians compared to military samples, studies of PTSD related to natural disasters and transportation accidents vs. other traumatic events, and studies of individual vs. group therapy. Findings support the overall efficacy of exposure therapy and highlight that there are a number of efficacious exposure-based therapies available.",PTSD 里的暴露治疗证据很扎实。重点在于重建对创伤线索的加工。,PTSD 板块里，暴露证据必须单列。,创伤治疗里，回避既是保护，也是维持因素。,yes
core_ptsd_psychological_2015_lewis,01_core_evidence,trauma_and_ocd,Psychological treatments for adults with posttraumatic stress disorder: A systematic review and meta-analysis.,成人 PTSD 的心理治疗：系统综述与元分析,"Cusack K, Jonas DE, Forneris CA, Wines C, Sonis J, Middleton JC, Feltner C, Brownley KA, Olmsted KR, Greenblatt A, Weil A, Gaynes BN.",2016,Clinical psychology review,系统综述与元分析,Psychological treatments for adult PTSD,成人 PTSD 的心理治疗总览,Adult PTSD,成人 PTSD,适合先看 PTSD 总图，再决定切入技术的时候。,Trauma-focused CBT; EMDR-related approaches; exposure-based treatments,创伤聚焦 CBT、EMDR 相关方法、暴露取向治疗,High,强烈推荐,426,Europe PMC citedByCount,2026-06-26,Elsevier Inc.,Q1,6.617,269,180,13.66,Clinical Psychology (Q1); Psychiatry and Mental Health (Q1),Resurchify / SCImago snapshot,https://www.resurchify.com/impact/details/12854,26574151,,10.1016/j.cpr.2015.10.003,N,N,N,N,https://doi.org/10.1016/j.cpr.2015.10.003,https://doi.org/10.1016/j.cpr.2015.10.003,https://doi.org/10.1016/j.cpr.2015.10.003,,"Numerous guidelines have been developed over the past decade regarding treatments for Posttraumatic stress disorder (PTSD). However, given differences in guideline recommendations, some uncertainty exists regarding the selection of effective PTSD therapies. The current manuscript assessed the efficacy, comparative effectiveness, and adverse effects of psychological treatments for adults with PTSD. We searched MEDLINE, Cochrane Library, PILOTS, Embase, CINAHL, PsycINFO, and the Web of Science. Two reviewers independently selected trials. Two reviewers assessed risk of bias and graded strength of evidence (SOE). We included 64 trials; patients generally had severe PTSD. Evidence supports efficacy of exposure therapy (high SOE) including the manualized version Prolonged Exposure (PE); cognitive therapy (CT), cognitive processing therapy (CPT), cognitive behavioral therapy (CBT)-mixed therapies (moderate SOE); eye movement desensitization and reprocessing (EMDR) and narrative exposure therapy (low-moderate SOE). Effect sizes for reducing PTSD symptoms were large (e.g., Cohen's d ~-1.0 or more compared with controls). Numbers needed to treat (NNTs) were <4 to achieve loss of PTSD diagnosis for exposure therapy, CPT, CT, CBT-mixed, and EMDR. Several psychological treatments are effective for adults with PTSD. Head-to-head evidence was insufficient to determine these treatments' comparative effectiveness, and data regarding adverse events was absent from most studies.",PTSD 总览文献。创伤聚焦治疗长期占一线。,给 PTSD 板块补总图。,先看全局，再选暴露、认知加工或其他创伤聚焦方案。,yes
core_ocd_erp_2021_jonsson,01_core_evidence,trauma_and_ocd,Cognitive behavioural therapy with exposure and response prevention in the treatment of obsessive-compulsive disorder: A systematic review and meta-analysis of randomised controlled trials.,结合暴露与反应预防的 CBT 治疗 OCD：随机对照试验系统综述与元分析,"Reid JE, Laws KR, Drummond L, Vismara M, Grancini B, Mpavaenda D, Fineberg NA.",2021,Comprehensive psychiatry,系统综述与元分析,CBT with ERP for OCD,结合 ERP 的认知行为治疗,Obsessive-compulsive disorder,强迫症,适合反复检查、清洗、确认、仪式行为明显的强迫症场景。,Exposure and response prevention; cognitive restructuring; ritual blocking,暴露与反应预防、认知重构、仪式阻断,High,强烈推荐,117,Europe PMC citedByCount,2026-06-26,W.B. Saunders,Q1,1.718,128,1868,5.30,Clinical Psychology (Q1); Psychiatry and Mental Health (Q1),Resurchify / SCImago snapshot,https://www.resurchify.com/impact/details/14921,33618297,,10.1016/j.comppsych.2021.152223,N,N,N,N,https://doi.org/10.1016/j.comppsych.2021.152223,https://doi.org/10.1016/j.comppsych.2021.152223,https://doi.org/10.1016/j.comppsych.2021.152223,,"Background Cognitive behavioural therapy (CBT), incorporating exposure and response prevention (ERP) is widely recognised as the psychological treatment of choice for obsessive-compulsive disorder (OCD). Uncertainty remains however about the magnitude of the effect of CBT with ERP and the impact of moderating factors in patients with OCD. Method This systematic review and meta-analysis assessed randomised-controlled trials of CBT with ERP in patients of all ages with OCD. The study was preregistered in PROSPERO (CRD42019122311). The primary outcome was end-of-trial OCD symptom scores. The moderating effects of patient-related and study-related factors including type of control intervention and risk of bias were examined. Additional exploratory analyses assessed the effects of treatment fidelity and impact of researcher allegiance. Results Thirty-six studies were included, involving 2020 patients (537 children/adolescents and 1483 adults) with 1005 assigned to CBT with ERP and 1015 to control conditions. When compared against all control conditions, a large pooled effect size (ES) emerged in favour of CBT with ERP (g = 0.74: 95% CI = 0.51 to 0.97 k = 36), which appeared to diminish with increasing age. While CBT with ERP was more effective than psychological placebo (g = 1.13 95% CI 0.71 to 1.55, k = 10), it was no more effective than other active forms of psychological therapy (g = -0.05: 95% CI -0.27 to 0.16, k = 8). Similarly, whereas CBT with ERP was significantly superior when compared to all forms of pharmacological treatment (g = 0.36: 95% CI 0.7 to 0.64, k = 7), the effect became marginal when compared with adequate dosages of pharmacotherapy for OCD (g = 0.32: 95% CI -0.00 to 0.64, k = 6).A minority of studies (k = 8) were deemed to be at low risk of bias. Moreover, three quarters of studies (k = 28) demonstrated suspected researcher allegiance and these studies reported a large ES (g = 0.95: 95% CI 0.69 to 1.2), while those without suspected researcher allegiance (k = 8) indicated that CBT with ERP was not efficacious (g = 0.02: 95% CI -0.29 to 0.33). Conclusions A large effect size was found for CBT with ERP in reducing the symptoms of OCD, but depends upon the choice of comparator control. This meta-analysis also highlights concerns about the methodological rigor and reporting of published studies of CBT with ERP in OCD. In particular, efficacy was strongly linked to researcher allegiance and this requires further future investigation.",OCD 的技术核心就是 ERP。这篇文献讲得很清楚。,强迫症最需要把技术名真正落到操作上。,不碰仪式化行为，很多洞察都落不了地。,yes
core_dbt_bpd_2021_kothgassner,01_core_evidence,personality_and_self_harm,Effects of dialectical behaviour therapy on reducing self-harming behaviours and negative emotions in patients with borderline personality disorder: A meta-analysis.,DBT 对边缘型人格障碍患者自伤行为与负性情绪的影响：元分析,"Chen SY, Cheng Y, Zhao WW, Zhang YH.",2021,Journal of psychiatric and mental health nursing,元分析,DBT,辩证行为治疗,Borderline personality disorder with self-harm and intense negative affect,边缘型人格障碍伴自伤和强烈负性情绪,适合情绪冲得很快、自伤冲动高、关系剧烈摆动的场景。,Chain analysis; distress tolerance; emotion regulation; mindfulness; interpersonal effectiveness,链式分析、痛苦耐受、情绪调节、正念、人际效能,High,强烈推荐,19,Europe PMC citedByCount,2026-06-26,Wiley-Blackwell Publishing Ltd,Q2,1.123,78,3987,3.68,Psychiatry and Mental Health (Q2),Resurchify / SCImago snapshot,https://www.resurchify.com/impact/details/16796,34519138,,10.1111/jpm.12797,N,N,N,N,https://doi.org/10.1111/jpm.12797,https://doi.org/10.1111/jpm.12797,https://doi.org/10.1111/jpm.12797,,"Introduction Dialectical behaviour therapy(DBT) has been widely used for borderline personality disorder(BPD). Existing studies are limited to behaviours such as self-harm, and the results for reducing self-harm were controversial. Few have systematically evaluated the effect of DBT on self-harming behaviours and negative emotions. Aim This study aims to evaluate the effects of DBT on self-harming behaviours and negative emotions in patients with BPD. Methods RCTs on DBT for BPD were searched from PubMed, Embase, etc., and the results were performed by RevMan 5.3. Results The meta-analysis demonstrated that DBT reduced self-harming behaviours, and alleviated depression, but had a negligible effect on suicidal ideation and anger. One subgroup revealed that standard DBT improved depression significantly, but DBT skills training improved poorly. Another subgroup revealed that there was a significant reduction in depression among patients receiving DBT for 4 months to 14 months, but not at 4 months. Discussion and implications for practice Findings indicate that DBT can reduce self-harming behaviours and improve depression, but effects on suicidal ideation and anger are insignificant. Subgroup analysis suggests that standard DBT and DBT-ST lasting beyond 4 months benefits on BPD. Given the quality and quantity restrictions of RCTs, more high-quality RCTs need to verify these effects.",DBT 在减少自伤和压低高强度负性情绪上有明确支持。,DBT 板块的核心证据。,DBT 的长处在训练，不在安慰。,yes
core_bpd_psychotherapies_2017_cristea,01_core_evidence,personality_and_self_harm,Efficacy of Psychotherapies for Borderline Personality Disorder: A Systematic Review and Meta-analysis.,边缘型人格障碍的心理治疗疗效：系统综述与元分析,"Cristea IA, Gentili C, Cotet CD, Palomba D, Barbui C, Cuijpers P.",2017,JAMA psychiatry,系统综述与元分析,Psychotherapies for BPD,边缘型人格障碍的多流派心理治疗,Borderline personality disorder,边缘型人格障碍,适合比较 BPD 的不同治疗路线，也适合跳出 DBT 单一路径来看。,"DBT, MBT, transference-focused and other specialized psychotherapies",DBT、MBT、移情焦点等人格障碍专项治疗,High,中度到强烈推荐,345,Europe PMC citedByCount,2026-06-26,American Medical Association,Q1,5.755,417,228,9.08,Medicine (miscellaneous) (Q1); Psychiatry and Mental Health (Q1),Resurchify / SCImago snapshot,https://www.resurchify.com/impact/details/21100228547,28249086,,10.1001/jamapsychiatry.2016.4287,N,N,N,N,https://doi.org/10.1001/jamapsychiatry.2016.4287,https://doi.org/10.1001/jamapsychiatry.2016.4287,https://doi.org/10.1001/jamapsychiatry.2016.4287,,"Importance Borderline personality disorder (BPD) is a debilitating condition, but several psychotherapies are considered effective. Objective To conduct an updated systematic review and meta-analysis of randomized clinical trials to assess the efficacy of psychotherapies for BPD populations. Data sources Search terms were combined for borderline personality and randomized trials in PubMed, PsycINFO, EMBASE, and the Cochrane Central Register of Controlled Trials (from database inception to November 2015), as well as the reference lists of earlier meta-analyses. Study selection Included were randomized clinical trials of adults with diagnosed BPD randomized to psychotherapy exclusively or to a control intervention. Study selection differentiated stand-alone designs (in which an independent psychotherapy was compared with control interventions) from add-on designs (in which an experimental intervention added to usual treatment was compared with usual treatment alone). Data extraction and synthesis Data extraction coded characteristics of trials, participants, and interventions and assessed risk of bias using 4 domains of the Cochrane Collaboration Risk of Bias tool (independent extraction by 2 assessors). Outcomes were pooled using a random-effects model. Subgroup and meta-regression analyses were conducted. Main outcomes and measures Standardized mean differences (Hedges g) were calculated using all outcomes reported in the trials for borderline symptoms, self-harm, suicide, health service use, and general psychopathology at posttest and follow-up. Differential treatment retention at posttest was analyzed, reporting odds ratios. Results Thirty-three trials (2256 participants) were included. For borderline-relevant outcomes combined (symptoms, self-harm, and suicide) at posttest, the investigated psychotherapies were moderately more effective than control interventions in stand-alone designs (g = 0.32; 95% CI, 0.14-0.51) and add-on designs (g = 0.40; 95% CI, 0.15-0.65). Results were similar for other outcomes, including stand-alone designs: self-harm (g = 0.32; 95% CI, 0.09-0.54), suicide (g = 0.44; 95% CI, 0.15-0.74), health service use (g = 0.40; 95% CI, 0.22-0.58), and general psychopathology (g = 0.32; 95% CI, 0.09-0.55), with no differences between design types. There were no significant differences in the odds ratios for treatment retention (1.32; 95% CI, 0.87-2.00 for stand-alone designs and 1.01; 95% CI, 0.55-1.87 for add-on designs). Thirteen trials reported borderline-relevant outcomes at follow-up (g = 0.45; 95% CI, 0.15-0.75). Dialectical behavior therapy (g = 0.34; 95% CI, 0.15-0.53) and psychodynamic approaches (g = 0.41; 95% CI, 0.12-0.69) were the only types of psychotherapies more effective than control interventions. Risk of bias was a significant moderator in subgroup and meta-regression analyses (slope β = -0.16; 95% CI, -0.29 to -0.03; P = .02). Publication bias was persistent, particularly for follow-up. Conclusions and relevance Psychotherapies, most notably dialectical behavior therapy and psychodynamic approaches, are effective for borderline symptoms and related problems. Nonetheless, effects are small, inflated by risk of bias and publication bias, and particularly unstable at follow-up.",BPD 不只有 DBT。多种结构化治疗都有证据，只是强弱和稳定性不同。,给人格障碍板块留出更完整的视野。,治疗选择要看风险、资源和来访者能否进入长期结构化工作。,yes
